{
  "schema_version": "1.0.0",
  "simulation": true,
  "convocation_id": "CONV-3-1",
  "project_id": "PID-20260723-T001",
  "dossier_ref": "EJEMPLO/dossier-v1",
  "dossier_hash": "sha256:ejemplo-3-1",
  "gate": "GR-2",
  "votes": {
    "GOB-02a": { "vote": "APROBAR", "justification": "Perspectiva editorial favorable simulada.", "norm_refs": ["MANUAL/CODIGOS/CODIGO_ESTILO.md"], "issued_at": "2026-07-23T12:01:00Z", "sealed": true, "saw_other_votes": false },
    "GOB-02b": { "vote": "APROBAR", "justification": "Perspectiva comercial favorable simulada.", "norm_refs": ["MANUAL/CODIGOS/CODIGO_COMERCIAL.md"], "issued_at": "2026-07-23T12:01:01Z", "sealed": true, "saw_other_votes": false },
    "GOB-02c": { "vote": "REQUIERE_CAMBIOS", "justification": "Existe una mejora de calidad reparable simulada.", "norm_refs": ["MANUAL/CODIGOS/CODIGO_CALIDAD.md"], "issued_at": "2026-07-23T12:01:02Z", "sealed": true, "saw_other_votes": false },
    "GOB-02d": { "vote": "APROBAR", "justification": "Perspectiva técnica favorable simulada.", "norm_refs": ["MANUAL/CODIGOS/CODIGO_SEGURIDAD.md"], "issued_at": "2026-07-23T12:01:03Z", "sealed": true, "saw_other_votes": false }
  },
  "consolidation": { "approve_count": 3, "non_approve_count": 1, "result": "APROBAR", "dissent": true, "requires_human_review": true, "rule": "3-1" },
  "human_approval": { "required": true, "status": "PENDIENTE", "decision_ref": null },
  "audit_ref": "AUD-EJEMPLO-3-1"
}
